{
  "schema": "schemas/open-source-policy.schema.json",
  "schemaVersion": 1,
  "policyId": "saferide-open-source-policy-v1",
  "status": "approved",
  "repository": {
    "authoritativeUrl": "https://github.com/esherialabs/saferide",
    "visibility": "public",
    "visibilityVerified": true,
    "unicefReviewerAccess": true,
    "publicationModel": "authoritative-public-repository"
  },
  "artifactClasses": [
    {
      "class": "code",
      "licenseFile": "LICENSE",
      "licenseExpression": "Apache-2.0",
      "approvalStatus": "approved",
      "redistributionAuthorized": true
    },
    {
      "class": "content",
      "licenseFile": "CONTENT-LICENSE.md",
      "licenseExpression": "CC-BY-4.0",
      "approvalStatus": "approved",
      "redistributionAuthorized": true
    },
    {
      "class": "model",
      "licenseFile": "MODEL-DATA-LICENSES.md",
      "licenseExpression": "Apache-2.0",
      "approvalStatus": "approved",
      "redistributionAuthorized": true
    },
    {
      "class": "dataset",
      "licenseFile": "MODEL-DATA-LICENSES.md",
      "licenseExpression": "CC-BY-4.0",
      "approvalStatus": "approved",
      "redistributionAuthorized": true
    },
    {
      "class": "evaluation",
      "licenseFile": "MODEL-DATA-LICENSES.md",
      "licenseExpression": "Apache-2.0 AND CC-BY-4.0",
      "approvalStatus": "approved",
      "redistributionAuthorized": true
    }
  ],
  "governance": {
    "maintainersConfirmed": true,
    "codeownersConfirmed": true,
    "trademarkDecisionApproved": true,
    "securityChannelVerified": true
  },
  "publicReleaseAuthorized": true,
  "externalHandoffId": "HANDOFF-OPEN-SOURCE-LEGAL",
  "lastVerifiedDate": "2026-08-18",
  "recheckDate": "2027-08-18"
}
